{
  "$schema": "market_regime_field_manifest.schema.v1.0.0.json",
  "manifest_format_version": "1.0.0",
  "schema_version": "5.1",
  "feature_contract_version": "5.1",
  "design_document": "regime/docs/Market_Regime_Design_v5.1.md",
  "design_sha256": "ee9414342b07b2033f77a8a2365406b809eed97bfa778eb260e2f5130288af87",
  "generated_at": "2026-08-25T07:00:00-04:00",
  "status": "architecture_baseline",
  "canonical_calendar": {
    "calendar_id": "XNYS",
    "timezone": "America/New_York",
    "frequency": "daily_expected_session",
    "session_semantics": "One record per expected XNYS session after required publications are available."
  },
  "source_contracts": [
    {
      "source_contract_id": "DERIVED_V5_1",
      "status": "CLOSED",
      "provider": "INTERNAL",
      "dataset": "market_regime_v5.1_derived",
      "symbol_or_collection": "DERIVED",
      "field": "derived feature",
      "frequency": "daily expected session",
      "timezone": "America/New_York",
      "adjustment_policy": "not applicable",
      "vintage_policy": "Content-addressed snapshot; refresh requires a new dataset_version and hashes before release.",
      "freshness_rule": "Refresh after each completed expected session; fail closed when the declared threshold is exceeded.",
      "missing_rule": "Required-input failure propagates null with reason; no silent fill.",
      "splice_policy": "No silent source splice within a published dataset version.",
      "dataset_version": "snapshot-2026-08-25",
      "source_tier": "internal",
      "snapshot_paths": [
        "regime/docs/Market_Regime_Design_v5.1.md"
      ],
      "snapshot_sha256": {
        "regime/docs/Market_Regime_Design_v5.1.md": "ee9414342b07b2033f77a8a2365406b809eed97bfa778eb260e2f5130288af87"
      },
      "refresh_policy": "Run the versioned updater after each completed session; recompute hashes and bump dataset_version before adoption.",
      "notes": "Normative derived-field contract.",
      "calendar": "XNYS_EXPECTED_SESSION",
      "observation_timestamp_policy": "as_of identifies the measurement session after all required source observations satisfy their point-in-time join rules.",
      "publication_timestamp_policy": "Emission timestamp is recorded after calculation; replay restores the same versioned source snapshot and engine state.",
      "availability_lag": "Inherits the maximum availability timestamp of every required direct and transitive source.",
      "point_in_time_join_rule": "Emit only when every required input is available for the as_of session; otherwise emit unavailable/stale state with reason codes.",
      "price_field_policy": "Not a raw price series; field selection is defined by the derived/output schema.",
      "corporate_action_policy": "Corporate actions are not applicable to internal derived or persisted-state records; upstream source versions remain traceable."
    },
    {
      "source_contract_id": "ENGINE_STATE_V5_1",
      "status": "CLOSED",
      "provider": "INTERNAL",
      "dataset": "market_regime_v5.1_engine_state",
      "symbol_or_collection": "ENGINE_STATE",
      "field": "state",
      "frequency": "daily expected session",
      "timezone": "America/New_York",
      "adjustment_policy": "not applicable",
      "vintage_policy": "Content-addressed snapshot; refresh requires a new dataset_version and hashes before release.",
      "freshness_rule": "Refresh after each completed expected session; fail closed when the declared threshold is exceeded.",
      "missing_rule": "Required-input failure propagates null with reason; no silent fill.",
      "splice_policy": "No silent source splice within a published dataset version.",
      "dataset_version": "snapshot-2026-08-25",
      "source_tier": "internal",
      "snapshot_paths": [
        "regime/docs/Market_Regime_Design_v5.1.md"
      ],
      "snapshot_sha256": {
        "regime/docs/Market_Regime_Design_v5.1.md": "ee9414342b07b2033f77a8a2365406b809eed97bfa778eb260e2f5130288af87"
      },
      "refresh_policy": "Run the versioned updater after each completed session; recompute hashes and bump dataset_version before adoption.",
      "notes": "Persisted replay-state contract.",
      "calendar": "XNYS_EXPECTED_SESSION",
      "observation_timestamp_policy": "as_of identifies the measurement session after all required source observations satisfy their point-in-time join rules.",
      "publication_timestamp_policy": "Emission timestamp is recorded after calculation; replay restores the same versioned source snapshot and engine state.",
      "availability_lag": "Inherits the maximum availability timestamp of every required direct and transitive source.",
      "point_in_time_join_rule": "Emit only when every required input is available for the as_of session; otherwise emit unavailable/stale state with reason codes.",
      "price_field_policy": "Not a raw price series; field selection is defined by the derived/output schema.",
      "corporate_action_policy": "Corporate actions are not applicable to internal derived or persisted-state records; upstream source versions remain traceable."
    },
    {
      "source_contract_id": "BENCHMARK_V5_1",
      "status": "EMPIRICAL",
      "provider": "Yahoo Finance via yfinance 0.2.66",
      "dataset": "Yahoo Finance historical OHLCV snapshot",
      "symbol_or_collection": "SPY",
      "field": "adj_close",
      "frequency": "daily expected session",
      "timezone": "America/New_York",
      "adjustment_policy": "Adjusted/total-return proxy; auto_adjust=false.",
      "vintage_policy": "Content-addressed snapshot; refresh requires a new dataset_version and hashes before release.",
      "freshness_rule": "Refresh after each completed expected session; fail closed when the declared threshold is exceeded.",
      "missing_rule": "Required-input failure propagates null with reason; no silent fill.",
      "splice_policy": "No silent source splice within a published dataset version.",
      "dataset_version": "snapshot-2026-08-25",
      "source_tier": "canonical_production",
      "snapshot_paths": [
        "research/data/raw/SPY.csv"
      ],
      "snapshot_sha256": {
        "research/data/raw/SPY.csv": "4d14d2dd547554d00d82d5c242dd7aced6f4b7f02728feb60a77167ad15b7991"
      },
      "refresh_policy": "Run the versioned updater after each completed session; recompute hashes and bump dataset_version before adoption.",
      "notes": "Pinned SPY benchmark; no within-version switching.",
      "calendar": "XNYS",
      "observation_timestamp_policy": "Date-only OHLCV row represents the completed XNYS regular session close at 16:00 America/New_York.",
      "publication_timestamp_policy": "Snapshot retrieval timestamp is provenance; the bar is not treated as published until the provider returns a completed daily row.",
      "availability_lag": "Usable for measurement decisions no earlier than the next XNYS session open after the observation session.",
      "point_in_time_join_rule": "Join only to the next XNYS expected session; never use a same-session close to make a decision timestamped before that close.",
      "price_field_policy": "Canonical calculations MUST read the provider-supplied adj_close CSV column. Raw open/high/low/close/volume are diagnostics only and MUST NOT substitute for adj_close.",
      "corporate_action_policy": "Provider adj_close supplies split and cash-distribution adjustments. Any historical restatement, symbol substitution, mapping change, or changed duplicate-session resolution changes the snapshot hash and requires a new dataset_version; no silent splice or substitution. Adopted snapshots MUST contain one row per XNYS session."
    },
    {
      "source_contract_id": "BREADTH_V5_1",
      "status": "EMPIRICAL",
      "provider": "Yahoo Finance via yfinance 0.2.66",
      "dataset": "Yahoo Finance historical OHLCV snapshots",
      "symbol_or_collection": "XLK,XLF,XLV,XLY,XLP,XLE,XLI,XLB,XLU",
      "field": "adj_close",
      "frequency": "daily expected session",
      "timezone": "America/New_York",
      "adjustment_policy": "Adjusted/total-return close; fixed denominator.",
      "vintage_policy": "Content-addressed snapshot; refresh requires a new dataset_version and hashes before release.",
      "freshness_rule": "Refresh after each completed expected session; fail closed when the declared threshold is exceeded.",
      "missing_rule": "Required-input failure propagates null with reason; no silent fill.",
      "splice_policy": "No silent source splice within a published dataset version.",
      "dataset_version": "snapshot-2026-08-25",
      "source_tier": "tier_2_fixed_nine_production",
      "snapshot_paths": [
        "research/data/raw/XLK.csv",
        "research/data/raw/XLF.csv",
        "research/data/raw/XLV.csv",
        "research/data/raw/XLY.csv",
        "research/data/raw/XLP.csv",
        "research/data/raw/XLE.csv",
        "research/data/raw/XLI.csv",
        "research/data/raw/XLB.csv",
        "research/data/raw/XLU.csv"
      ],
      "snapshot_sha256": {
        "research/data/raw/XLK.csv": "4807cd9df78ed102a784390380122484f15e6510ea07931f562ce287868be722",
        "research/data/raw/XLF.csv": "8dde1bd5d6f74bcae29236bac48124e957f465c37f8cded4384207000bfcc0de",
        "research/data/raw/XLV.csv": "5025c837913f919cf75f589c4891bc87e1f286814e44626ff62b6cc7c0c7fa90",
        "research/data/raw/XLY.csv": "a4bdb6f98c375bd3175ed91c64d1d5f89aac2f231c0b53c2f31c94bb7ff8f017",
        "research/data/raw/XLP.csv": "a8eaf40026e32d303bc2552365aa1d58bbb6ab1a333dda4e21434a7fed6382f6",
        "research/data/raw/XLE.csv": "95333ca2c8f6a7aa781964ab3f9394b2e19bce49e0fe625ff0dff7216e47efd9",
        "research/data/raw/XLI.csv": "1a034e5077ffb2e47c65cff7953473bbc93819b352d4d3b0d0af9701ed309440",
        "research/data/raw/XLB.csv": "d816b8cccbfc08e64623d086df380707a115d79dc655486ddaca7475888afcb9",